subject_id,topic_id,question_type,question,marks,time_to_spend,difficulty_level,hint,explanation,total_answers,correct_answer,answer1,answer2,answer3,answer4,answer5,,, Water flows a tank 200 x 150m through a rectangular pipe 1.5 x 1.25m at the rate at 20kmph. In what time will be water rises by 2 meters?,,,,,,4,4,76 min,80min,90min,96min
,,," The difference between the length and breadth of a rectangle is 23 m. If its perimeter is 206 m, then its area is:",,,,,,4,4,1520 m2,2420 m2,2480 m2,2520 m2
,,," The length of a rectangle is halved, while its breadth is tripled. What is the percentage change in area?",,,,,,4,2,25% increase,50% increase,50% decrease,75% decrease
,,," The length of a rectangular plot is 20 metres more than its breadth. If the cost of fencing the plot @ 26.50 per metre is Rs. 5300, what is the length of the plot in metres?",,,,,,5,5,40,50,120,Data inadequate,None of These
,,," A rectangular field is to be fenced on three sides leaving a side of 20 feet uncovered. If the area of the field is 680 sq. feet, how many feet of fencing will be required?",,,,,,4,4,34,40,68,88
,,, Jay’s room has a floor of 8m by 4m. He decides to tile the floor with tiles of 25cm x 20 cm. How many tiles will he need?,,,,,,4,2,320 tiles,640 tiles,160 tiles,6.4 tiles
