subject_id,topic_id,question_type,question,marks,time_to_spend,difficulty_level,hint,explanation,total_answers,correct_answer,answer1,answer2,answer3,answer4,answer5
,,," A cycle is bought for Rs.900 and sold for Rs.1080, find the gain percent?",,,,,,4,2,16 2/3%,20%,18%,25%
,,," An article is bought for Rs.675 and sold for Rs.900, find the gain percent?",,,,,,4,3,16 2/3%,30%,33 1/3%,33 1/6%
,,," An article is bought for Rs.600 and sold for Rs.500, find the loss percent?",,,,,,4,4,16 4/3%,100/3%,16%,16 2/3%
,,," The cost price of a radio is Rs.1500 and it was sold for Rs.1230, find the loss %?",,,,,,4,1,18%,9%,15%,6%
,,," A watch was sold at a loss of 10%. If it was sold for Rs.140 more, there would have been a gain of 4%. What is the cost price?",,,,,,4,1,Rs.1000,Rs.1140,Rs.860,Rs.760
,,, The sale price sarees listed for Rs.400 after successive discount is 10% and 5% is?,,,,,,4,3,Rs.357,Rs.340,Rs.342,Rs.338
,,," The list price of an article is Rs.65. A customer pays Rs.56.16 for it. He was given two successive discounts, one of them being 10%. The other discount is?",,,,,,4,2,3%,4%,5%,6%
,,," A single discount equivalent to the discount series of 20%, 10% and 5% is?",,,,,,4,3,25%,30%,31.6%,33.5%
,,," What profit percent is made by selling an article at a certain price, if by selling at 2/3rd of that price, there would be a loss of 20%?",,,,,,4,1,20%,25%,13 1/30%,12%
,,, A trader bought a car at 20% discount on its original price. He sold it at a 40% increase on the price he bought it. What percent of profit did he make on theoriginal price?,,,,,,4,3,10%,11%,12%,15%
,,," A man sells a horse for Rs.800 and loses something, if he had sold it for Rs.980, his gain would have been double the former loss. Find the cost price of thehorse?",,,,,,4,4,Rs.900,Rs.875,Rs.850,Rs.860
,,," By selling a house for Rs.45000, it was found that 1/8 of the outlay was gained, what ought the selling to price to have been in order to have lost 5 p.c?",,,,,,4,2,Rs.38750,Rs.38000,Rs.40000,Rs.42000
,,, If a man lost 4% by selling oranges at the rate of 12 a rupee at how many a rupee must he sell them to gain 44%?,,,,,,4,2,7,8,9,10
,,," By selling 150 mangoes, a fruit-seller gains the selling price of 30 mangoes. Find the gain percent?",,,,,,4,2,20%,25%,18%,30%
,,, The C.P of 10 pens is equal to the S.P of 12 pens. Find his gain % or loss%?,,,,,,4,3,16 2/3% profit,50/6% profit,16 2/3% loss,100/3% loss
,,, The C.P of 15 books is equal to the S.P of 18 books. Find his gain% or loss%?,,,,,,4,1,16 2/3% loss,100/3% loss,50/3% profit,100/3% loss
,,, By selling 12 pencils for a rupee a man loses 20%. How many for a rupee should he sell in order to gain 20%?,,,,,,4,1,8,9,12,16
,,, The cost price of 13 articles is equal to the selling price of 11 articles. Find the profit percent?,,,,,,4,2,15 5/15%,18 2/11%,16 2/3%,30%
,,, By selling 50 meters of cloth. I gain the selling price of 15 meters. Find the gain percent?,,,,,,4,4,35%,30%,40%,42 6/7%
,,," Ram sold two bicycles, each for Rs.990. If he made 10% profit on the first and 10% loss on the second, what is the total cost of both bicycles?",,,,,,4,1,Rs.2000,Rs.1980,Rs.1891,Rs.1750
,,, A tradesman by means of his false balance defrauds to the extent of 20%? in buying goods as well as by selling the goods. What percent does he gain on hisoutlay?,,,,,,4,3,20%,45%,44%,48%
,,," A dishonest dealer professes to sell goods at the cost price but uses a weight of 800 grams per kg, what is his percent?",,,,,,4,2,20%,25%,30%,15%
,,," Ram professes to sell his goods at the cost price but he made use of 900 grms instead of a kg, what is the gain percent?",,,,,,4,3,11%,11 2/9%,11 1/9%,10%
,,, A dishonest dealer professes to sell goods at the cost price but uses a false weight and gains 25%. Find his false weight age?,,,,,,4,3,700 gms,750 gms,800 gms,850 gms
,,," A man purchases 8 pens for Rs.9 and sells 9 pens for Rs.8, how much profit or loss does he make?",,,,,,4,2,20.98% profit,20.98% loss,20.89% profit,20.89% loss
,,," A reduction of 40% in the price of bananas would enable a man to obtain 64 more for Rs.40, what is reduced price per dozen?",,,,,,4,4,Rs.5,Rs.4,Rs.2,Rs.3
,,," A reduction of 25% in the price of oil enables a house wife to obtain 5kgs more for Rs.800, what is the reduced price for kg?",,,,,,4,3,Rs.20,Rs.30,Rs.40,Rs.25
,,," A reduction of 20% in the price of salt enables a lady to obtain 10kgs more for Rs.100, find the original price per kg?",,,,,,4,3,2 3/2,2 2/3,2.5,3
,,, A man buys two articles for Rs.1980 each and he gains 10% on the first and loses 10% on the next. Find his total gain or loss percent?,,,,,,4,1,1% gain,1% loss,10% loss,no gain or no loss
,,, A man sells two articles for Rs.3600 each and he gains 30% on the first and loses 30% on the next. Find his total gain or loss?,,,,,,4,1,9% loss,400,4000,324
,,, I bought two books; for Rs.480. I sold one at a loss of 15% and other at a gain of 19% and then I found each book was sold at the same price. Find the cost of the book sold at a loss?,,,,,,4,2,Rs.28,Rs.280,Rs.140,Rs.70
,,," A man buys an article and sells it at a profit of 20%. If he had bought it at 20% less and sold it for Rs.75 less, he could have gained 25%. What is the costprice?",,,,,,4,2,Rs.370,Rs.375,Rs.350,Rs.300
,,," A person bought an article and sold it at a loss of 10%. If he had bought it for 20% less and sold it for Rs.75 less, he could have gained 25%. What is the cost price?",,,,,,4,1,Rs.250,Rs.225,Rs.275,Rs.200
,,, If goods be purchased for Rs.840 and one-fourth be sold at a loss of 20% at what gain percent should the remainder be sold so as to gain 20% on the whole transaction?,,,,,,4,3,30%,33%,33 1/3%,35%
,,," Oranges are bought at 11 for a rupee and an equal number more at 9 a rupee. If these are sold at 10 for a rupee, find the loss or gain percent?",,,,,,4,3,1% gain,2% gain,1% loss,2% loss
,,, A dealer purchased an article at 3/4 of its list price and sold 50% more than the list price. Find his gain percent?,,,,,,4,3,75%,50%,100%,80%
,,, At what price must an article costing Rs.47.50 be marked in order that after deducting 5% from the list price. It may be sold at a profit of 25% on the costprice?,,,,,,4,1,Rs.62.50,Rs.72.50,Rs.75.00,Rs.80.00
,,, A trader marked the price of a car 20% above the cost price and allowed the purchaser 5% discount on the marked price there by gained Rs.8400. Find the cost price of the car?,,,,,,4,1,Rs.60000,Rs.75000,Rs.68400,Rs.78400
,,," A trader marked the price of the T.V. 30% above the cost price of the T.V. and gave the purchaser 10% discount on the marked price, thereby gaining Rs.340. Find the cost price of the T.V?",,,,,,4,2,Rs.2250,Rs.2000,Rs.2150,Rs.2200
,,, A man buys milk at a certain rate per liter and after adding water to it sells the mixture at the same rate. Find in what ration he much mix water to milk soas to gain 20% on his outlay?,,,,,,4,1,1:5,1:20,2:5,1:6
,,, A person buys an article at Rs.500. At what price should he sell the article so as to make a profit of 20%?,,,,,,4,1,Rs.600,Rs.500,Rs.250,Rs.700
,,," By selling an article at Rs.600, a profit of 25% is made. Find its cost price?",,,,,,4,4,Rs.350,Rs.400,Rs.573,Rs.480
,,," By selling an article at Rs.800, a shopkeeper makes a profit of 25%. At what price should he sell the article so as to make a loss of 25%?",,,,,,4,2,Rs.600,Rs.480,Rs.500,Rs.450
,,," A shopkeeper buys two articles for Rs.1000 each and then sells them, making 20% profit on the first article and 20% loss on second article. Find the net profit or loss percent?",,,,,,4,1,neither profit nor loss,1%,2%,3%
,,," A shopkeeper sells two articles at Rs.1000 each, making a profit of 20% on the first article and a loss of 20% on the second article. Find the net profit or loss that he makes?",,,,,,4,4,neither profit nor loss,3%,5%,4%
,,, A shopkeeper buys mangoes at the rate of 4 a rupee and sells them at 3 a rupee. Find his net profit or loss percent?,,,,,,4,3,20%,28%,33 1/3 %,35 2/7 %
,,, A dishonest dealer professes to sell his goods at Cost Price but still gets 20% profit by using a false weight. What weight does he substitute for a kilogram?,,,,,,4,2,855 1/2 grams,833 1/3 grams,833 1/2 grams,875 2/7 grams
,,," The owner of a furniture shop charges his customer 24% more than the cost price. If a customer paid Rs. 8339 for a computer table, then what was the cost price of the computer table?",,,,,,5,4,Rs. 5725,Rs. 5275,Rs. 6275,Rs. 6725,None of these
,,, A person purchased a TV set for Rs. 16000 and a DVD player for Rs. 6250. He sold both the items together for Rs. 31150. What percentage of profit did he make?,,,,,,5,3,30%,35%,40%,45%,None of these
,,, Ramu bought an old car for Rs. 42000. He spent Rs. 13000 on repairs and sold it for Rs. 64900. What is his profit percent?,,,,,,5,3,14%,16%,18%,22%,None of these
,,, A trader sells 85 meters of cloth for Rs. 8925 at the profit of Rs. 15 per metre of cloth. What is the cost price of one metre of cloth?,,,,,,5,3,Rs. 80,Rs. 85,Rs. 90,Rs. 95,None of these
,,," A shopkeeper loses 15%,if an article is sold for Rs. 102. What should be the selling price of the article to gain 20%?",,,,,,5,2,Rs. 150,Rs. 144,Rs. 138,Rs. 132,None of these
,,," If an article is sold at 19% profit instead of 12% profit, then the profit would be Rs. 105 more. What is the cost price?",,,,,,5,3,Rs. 1505,Rs. 1510,Rs. 1500,Rs. 1490,None of these
,,, Raman mixed 24 kg of butter at Rs. 150 per kg with 36 kg butter at the rate of Rs. 125 per kg. At what price per kg should he sell the mixture to make a profit of 40% in the transaction?,,,,,,5,3,Rs. 135,Rs. 162,Rs. 189,Rs. 198,None of these
,,," Vijay bought 160 shirts at the rate of Rs. 225 per shirt. The transport expenditure was Rs. 1400. He paid an octroi at the rate of Rs. 1.75 per shirt and labour charges were Rs. 320. What should be the selling price of one shirt, if he wants a profit of 20%?",,,,,,5,4,Rs. 258,Rs. 270,Rs. 277.5,Rs. 285,None of these
,,, Sreenivas sells a table to Shiva at 10% profit and Shiva sells it to Mahesh at 10% loss. At what price did Sreenivas purchase the table if Mahesh paid Rs. 2178?,,,,,,5,3,Rs. 2100,Rs. 2150,Rs. 2200,Rs. 2250,None of these
,,," If a trader sold two cars each at Rs. 325475 and gains 12% on the first and loses 12% on the second, then his profit or loss percent on the whole is?",,,,,,5,1,1.44% loss,14.4% profit,14.4% loss,0%,None of these
,,," If the cost price of 50 articles is equal to the selling price of 40 articles, then the gain or loss percent is?",,,,,,5,5,20% loss,20% profit,10% profit,25% loss,None of these
,,, A dealer purchases 15 articles for Rs. 25 and sells 12 articles for Rs. 30. Find the profit percentage?,,,,,,5,2,25%,50%,20%,5%,None of these
,,," By selling 99 pens, a trader gains the cost of 33 pens. Find his gain percentage?",,,,,,5,1,33 1/3%,50%,25%,66 2/3%,None of these
,,, A fruit vendor purchased 20 dozens of bananas at Rs. 15 per dozen. But one-fourth of the bananas were rotten and had to be thrown away. He sold two-third of the remaining bananas at Rs. 22.50 per dozen. At what price per dozen should he sell the remaining bananas to make neither a profit nor a loss?,,,,,,5,2,Rs. 20,Rs. 15,Rs. 22.50,Rs. 7.50,None of these
,,, A shopkeeper sells 20% of his stock at 10% profit ans sells the remaining at a loss of 5%. He incurred an overall loss of Rs. 400. Find the total worth of the stock?,,,,,,5,2,Rs. 25000,Rs. 20000,Rs. 15000,Rs. 22000,None of these
,,," After allowing a discount of 15% on the marked price, the selling price is Rs. 6800 for an article. If it was sold at marked price, there would have been a profit of 60%. The cost price of the article is?",,,,,,5,3,Rs. 6400,Rs. 5600,Rs. 5000,Rs. 4800,None of these
,,," The value of a machine depreciates at 20% per annum. If its present value is Rs. 1,50,000, at what price should it be sold after two years such that a profit of Rs. 24,000 is made?",,,,,,5,2,"Rs. 1,10,000","Rs. 1,20,000","Rs. 1,24,000","Rs. 1,21,000",None of these
,,, A shopkeeper sells 400 metres of cloth for Rs. 18000 at a loss of Rs.5 per metre. Find his cost price for one metre of cloth?,,,,,,5,4,Rs. 45,Rs. 40,Rs. 35,Rs. 50,None of these
,,, Ramesh purchased a refrigerator for Rs. 12500 after getting a discount of 20% on the labelled price. He spent Rs. 125 on transport and Rs. 250 on installation. At what price should it be sold so that the profit earned would be 10% if no discount was offered?,,,,,,5,4,Rs. 16500,Rs. 15525,Rs. 17000,Rs. 17600,None of these
,,, The successive discounts 20% and 15% are equal to a single discount of?,,,,,,5,3,35%,38%,32%,29%,None of these
,,, A shopkeeper purchased 70 kg of potatoes for Rs. 420 and sold the whole lot at the rate of Rs. 6.50 per kg. What will be his gain percent?,,,,,,4,3,4 1/6 %,6 1/6 %,8 1/3 %,20 %
,,, Sam purchased 20 dozens of toys at the rate of Rs. 375 per dozen. He sold each one of them at the rate of Rs. 33. What was his percentage profit?,,,,,,4,3,3.5,4.5,5.6,6.5
,,," The sale price of an article including the sales tax is Rs. 616. The rate of sales tax is 10%. If the shopkeeper has made a profit of 12%, then the cost price of the article is:",,,,,,4,1,Rs. 500,Rs. 515,Rs. 550,Rs. 600
,,, Jacob brought a scooter for a certain sum of money. He spent 10% of the cost on repairs and sold the scooter for a profit of Rs. 1100. How much did he spend on repairs if he made a profit of 20%?,,,,,,4,3,Rs. 400,Rs. 440,Rs. 500,Rs. 550
,,, The ratio of the cost price and the selling price is 4:5. The profit percent is:,,,,,,4,3,10%,20%,25%,30%
,,, The ratio between the sale price and the cost price of an article is 7:5. What is the ratio between the profit and the cost price of that article?,,,,,,5,5,2:7,5:2,7:2,Data inadequate,None of these
,,," A man gains 20% by selling an article for a certain price. If the sells it at double the price, the percentage of profit will be:",,,,,,4,4,40,100,120,140
,,," If selling price is doubled, the profit triples. Find the profit percent:",,,,,,4,2,66 2/3,100,105 1/3,120
,,," In a certain store, the profit is 320% of the cost. If the cost increases by 25% but the selling price remains constant, approximately what percentage of the selling price is the profit?",,,,,,4,2,30%,70%,100%,250%
,,, The profit earned by selling an article for Rs. 832 is equal to the loss incurred when the same article is sold for Rs. 448. What should be the sale price for making 50% profit?,,,,,,4,2,Rs. 920,Rs. 960,Rs. 1060,Rs. 1200
,,, The percentage profit earned by selling an article for Rs. 1920 is equal to the percentage loss incurred by selling the same article for Rs. 1280. At what price should the article be sold to make 25% profit?,,,,,,4,1,Rs. 2000,Rs. 2200,Rs. 2400,None of these
,,," If the cost price of 12 pens is equal to the selling price of 8 pens, the gain percent is:",,,,,,4,3,25%,33 1/3 %,50%,66 2/3 %
,,," If the selling price of 50 articles is equal to the cost price of 40 articles, then the loss or gain percent is:",,,,,,4,1,20% loss,20% gain,25% loss,25% gain
,,," On an order of 5 dozen boxes of a consumer product, a retailer receives an extra dozen free. This is equivalent to allowing him a discount of:",,,,,,4,3,15%,16 1/6%,16 2/3%,20%
,,, A vendor bought toffees at 6 for a rupee. How many for a rupee must he sell to gain 20%?,,,,,,4,3,3,4,5,6
,,," By selling 12 toffees for a rupee, a man loses 20%. How many for a rupee should be sell to get a gain of 20%?",,,,,,4,2,5,8,10,15
,,, Arun purchased 30 kg of wheat at the rate of Rs. 11.50 per kg and 20 kg of wheat at the rate of 14.25 per kg. He mixed the two and sold the mixture. Approximately what price per kg should be sell the mixture to make 30% profit?,,,,,,5,4,Rs. 14.80,Rs. 15.40,Rs. 15.60,Rs. 16.30,Rs. 18.20
,,," By mixing two brands of tea and selling the mixture at the rate of Rs. 177 per kg. a shopkeeper makes a profit of 18%. If to every 2 kg of one brand costing Rs. 200 per kg, 3 kg of the other brand is added, then how much per kg does the other brand cost?",,,,,,4,4,Rs. 110,Rs. 120,Rs. 140,None of these
,,, A fair price shopkeeper takes 10% profit on his goods. He lost 20% goods during theft. His loss percent is:,,,,,,4,4,8,10,11,12
,,," A sells a bicycle to B at a profit of 20%. B sells it to C at a profit of 25%. If C pays Rs. 225 for it, the cost price of the bicycle for A is:",,,,,,4,4,Rs. 110,Rs. 120,Rs. 125,Rs. 150
,,," A manufacturer sells a pair of glasses to a wholesale dealer at a profit of 18%. The wholesaler sells the same to retailer at a profit of 20%. The retailer in turn sells them to a customer for Rs. 30.09, there by earning a profit of 25%. The cost price for the manufacturer is:",,,,,,4,3,Rs. 15,Rs. 16,Rs. 17,Rs. 18
,,, A man buys an article for 10% less than its value and sells it for 10% more than its value. His gain or loss percent is:,,,,,,4,4,"no profit, no loss",20% profit,less than 20% profit,more than 20% profit
,,," If 5% more is gained by selling an article for Rs. 350 than by selling it for Rs. 340, the cost of the article is:",,,,,,4,3,Rs. 50,Rs. 160,Rs. 200,Rs. 225
,,, The cash difference between the selling prices of an article at a profit of 4% and 6% is Rs. 3. The ratio of the two selling prices is:,,,,,,4,2,51:52,52:53,51:53,52:55
,,," A person purchases 90 clocks and sells 40 clocks at a gain of 10% and 50 clocks at a gain of 20%. If he sold all of them at a uniform profit of 15%, then he would have got Rs. 40 less. The cost price of each clock is:",,,,,,4,3,Rs.50,Rs.60,Rs.80,Rs.90
,,," Albert buys 4 horses and 9 cows for Rs. 13,400. If he sells the horses at 10% profit and the cows at 20% profit, then he earns a total profit of Rs. 1880. The cost of a horse is:",,,,,,4,2,Rs. 1000,Rs. 2000,Rs. 2500,Rs. 3000
,,," The price of a VCR is marked at Rs. 12,000. If successive discounts of 15%, 10% and 5% be allowed, then at what price does a customer buy it?",,,,,,4,2,Rs. 8400,Rs. 8721,Rs. 8856,None of these
,,," By selling an umbrella for Rs. 300, a shop keeper gains 20%. During a clearance sale, the shopkeeper allows a discount of 10% on the marked price. His gain percent during  the sale is:",,,,,,4,3,7,7.5,8,9
,,, The cost price of an article is 64% of the marked price. Calculate the gain percent after allowing a discount of 12%?,,,,,,4,1,37.5%,48%,50.5%,52%
,,, A shopkeeper sold an article offering a discount of 5% and earned a profit of 23.5%. What would have been the percentage of profit earned if no discount was offered?,,,,,,5,3,24.5,28.5,30,Data inadequate,None of these
,,, A man buys 10 articles for Rs. 8 and Sells them at the rate of Rs. 1.25 per article. His gain is:,,,,,,4,4,20%,50%,19 ½ %,56 ¼ %
,,, There would be 10% loss if a toy is said at Rs. 10.80 per piece. At what price should it be sold to earn a profit of 20%?,,,,,,4,3,Rs. 12,Rs. 12.96,Rs. 14.40,None of these
,,, There would be 10% loss if rice is sold at Rs. 5.40 per kg. At what price per kg should it  be sold to earn a profit of 20% ,,,,,,4,4,Rs. 6,Rs. 6.48,Rs. 7.02,Rs. 7.20
,,, A man sells 320 mangoes at the cost of 400 mangoes. His gain percent is:,,,,,,4,4,10%,15%,20%,25%
,,, If books bought at prices ranging from Rs. 200 to Rs. 350 are sold at prices ranging from Rs. 300 to Rs. 425. What is the greatest possible profit that might be made in selling 8 books?,,,,,,4,4,Rs. 400,Rs. 600,Cannot be determined,None of these
,,," If I purchased 11 books for Rs. 10 and sold all at the rate of 10 books for Rs. 11, the profit percent",,,,,,4,3,10%,11%,21%,100%
,,, A man purchased a  watch for Rs. 400 and sold it at a gain of 20% of the selling price. The selling price of the watch is:,,,,,,4,4,Rs. 300,Rs. 320,Rs. 440,Rs. 500
,,, The C.P of an article is 40% of the S.P. The percent that the S.P is of C.P is:,,,,,,4,4,40,60,240,250
,,, Aloke bought 25kg of rice at the rate of Rs. 6 per kg and 35 kg of rice at the rate of Rs. 7 per kg. He mixed the two and sold the mixture at the rate of Rs. 6.75 per kg. What was his gain or loss on the transaction?,,,,,,4,4,Rs. 16 gain,Rs. 16 loss,Rs. 20 gain,None of these
,,, A man sold 20 articles for Rs. 60 and gained 20%. How many articles did he buy for Rs.60?,,,,,,4,2,22,24,25,26
,,, A dealer professing to sell at cost price uses a 900 gms weight for a kilogram. His gain percent is:,,,,,,4,4,9,10,11,11 1/9
,,," By selling 12 oranges for one rupee, a man loses 20%. How many for a rupee should he sell to get a gain of 20%?",,,,,,4,2,5,8,10,15
,,," By selling Toffees at 20 for a rupee, a man loses 40 %. To gain 20 %, for one rupee he must sell",,,,,,4,1,16 toffees,20 toffees,25 toffees,24 toffees
,,, Jimmy bought paper sheets for Rs. 7200 and spent Rs. 200 on transport. Paying Rs 600 he had 330 boxes made. Which he said at Rs. 28 each. What is his profit Percentage?,,,,,,4,1,15.5,40,60,None of these
,,, Ram bought 4 dozen apples at Rs. 12 per dozen and 2 dozen apples at Rs. 16 per dozen. He sold all of them to earn 20%. At what price per dozen did he sell the apples?,,,,,,4,2,Rs. 14.40,Rs. 16.00,Rs. 16.80,Rs. 19.20
,,, A owns a house worth Rs. 10000. He sells it to B at a profit of 10% based on the worth of the house. B sells the house back to A at a loss of 10% in this transaction A gets,,,,,,4,3,No profit No loss,Profit of Rs. 1000,Profit of Rs. 1100,Profit of Rs. 2000
,,, When the price of a toy was increased by 20 % of the number of toys sold was decreased by 15 %. What was the effect on the sales of the shop?,,,,,,4,3,4 % increase,4 % decrease,2 % increase,2 % decrease
,,, When the Price of fans was reduced by 20 %. The number of fans sold increased by 40 %. What was the effect on the sales of rupees?,,,,,,4,1,12 % Increase,12 % decrease,30 % increase,40 % increase
,,," A man sold two houses for Rs. 7.8 lakhs each. On the one, he gained 5% and on the other, he lost 5%. What percent is the effect of the sale on the whole?",,,,,,4,1,0.25 % loss,0.25 % gain,25% loss,25% gain
,,, A horse and a cow were sold for Rs. 12000 each. The horse was sold at a loss of 20 % and the cow at a gain of 20 %. The entire transaction resulted in,,,,,,4,2,No loss or gain,Loss of Rs. 1000,Gain of Rs. 1000,Gain of Rs. 2000
,,, A merchant sold his goods for Rs. 75 at a profit percent equal to C.P. The C.P was:,,,,,,4,2,Rs. 40,Rs. 50,Rs. 60,Rs. 70
,,, Profit after selling a commodity for Rs. 425 is same as loss after selling it for Rs.355. The cost of the commodity is:,,,,,,4,2,Rs. 385,Rs. 390,Rs. 395,Rs. 400
,,, If two mixers and one T.V cost Rs. 7000. While two T.V s and one mixer cost Rs. 9800. The value of one T.V is:,,,,,,4,3,Rs. 2800,Rs. 2100,Rs. 4200,Rs. 8400
,,, Bhajan Singh purchased  120 reams of paper at Rs. 80 per ream. He spent Rs. 280 on transportation. Paid octrai at the rate of 40 paise per ream and paid Rs. 72 to the coolie. If he wants to have a gain of 8 %. What must be the selling price per ream?,,,,,,4,4,Rs. 86,Rs. 87.48,Rs. 89,Rs. 90
,,, A man sells a car to his friend at 10 % loss. If the friend sells it for Rs. 54000 and gains 20 %. The original C.P of the car was:,,,,,,4,3,Rs. 25000,Rs. 37500,Rs. 50000,Rs. 60000
,,, The cost price of an article which on being sold at a gain of 12 % yields Rs. 6 more than when it is sold at a loss of 12 % is:,,,,,,4,2,Rs. 30,Rs. 25,Rs. 24,Rs. 20
,,, A person bought an article and sold it at a loss of 10 % if he had bought it for 20 % less and sold it for Rs. 55 more he would have had a profit of 40 %. The C.P of the article is:,,,,,,4,3,Rs. 200,Rs. 225,Rs. 250,None of these
,,, At what price must kantilal sell a mixture of 80 kg sugar at Rs. 6.75 per kg with 120 kg at Rs. 8 per kg to gain 20%?,,,,,,4,4,Rs. 7.50 per kg,Rs. 8.20 per kg,Rs. 8.85 per kg,Rs. 9 per kg
,,, Subhash purchased a tape recorder at 9/10th of its selling price and sold it at 8% more than its S.P. His gain is:,,,,,,4,4,8%,10%,18%,20 %
,,," A discount series of 10%, 20% and 40% is equal to a single discount of:",,,,,,4,2,50%,56.8%,60%,70.28%
,,, The ratio of the prices of three different types of cars is 4:5:7. If the difference between the costliest and the cheapest cars is Rs. 60000 the price of the car of modest price is:,,,,,,4,2,Rs. 80000,Rs. 100000,Rs. 140000,Rs. 120000
,,, Kabir buys an article with 25% discount on its marked price. He makes a profit of 10 % by selling it at Rs. 660. The marked price is :,,,,,,4,3,Rs. 600,Rs. 700,Rs. 800,Rs. 685
,,, An umbrella marked at Rs. 80 is sold for Rs. 68. The rate of discount is: ,,,,,,4,1,15%,12%,17 11/17%,20 %
,,," A retailer buys a sewing machine at a discount of 15% and sells it for Rs. 1955. Thus, he makes a profit of 15%. The discount is:",,,,,,4,3,Rs. 270,Rs. 290,Rs. 300,None of these
,,, A Shopkeeper earns a profit of 12% on selling a book at 10% discount on the printed. The ratio of the cost price and the printed price of the book is:,,,,,,4,1,45:56,50:61,99:125,None of these
,,," While selling the watch, a shopkeeper gives a discount of 5% if he gives a discount of 7 % he earns Rs. 15 less as profit. The marked price of the watch is:",,,,,,4,4,Rs. 697.50,Rs. 712.50,Rs. 787.50,None of these
,,, A trader lists his articles 20% above C.P and allows a discount of 10% on cash payment. His gain percent is:,,,,,,4,2,10%,8%,5%,6%
,,," The marked price is 10% higher than the cost price. A discount of 10% is given on the marked price, in this kind of sale the seller",,,,,,4,3,Bears no loss no gain,gains,loses 1%,None of these
,,, A man purchases an electric heater whose printed price is 160 if he received two successive discounts of 20% and 10% he paid:,,,,,,4,4,Rs. 112,Rs. 129.60,Rs. 119.60,Rs. 115.20
,,, Tarun bought a T.V with 20% discount on the labelled price. Had he bought it with 25% discount? He would have saved Rs. 500. At what price did he buy the T.V?,,,,,,4,2,Rs. 5000,Rs. 10000,Rs. 12000,Rs. 16000
