subject_id,topic_id,question_type,question,marks,time_to_spend,difficulty_level,hint,explanation,total_answers,correct_answer,answer1,answer2,answer3,answer4,answer5,,, The difference between a discount of 40% on Rs. 500 and two successive discount of 36% and 4% on the same amount is:,,,,,,4,4,0,Rs. 2,Rs. 1.93,Rs. 7.20
,,, The price of an article was increased by P%. Later the new price was decreased by P% if the latest price was Rs. 1. The original price was:,,,,,,4,3,Rs. 1,.,.,Rs.2
,,, A cloth merchant has announced 25% rebate in prices. If one needs to have a rebate of Rs. 40. Then how many shirts each costing Rs.32 he should purchase?,,,,,,4,2,6,5,10,7
,,, A dealer marks his goods 20% above cost price. He then allows some discount on it and makes a profit of 8%. The rate of discount is:,,,,,,4,2,12%,10%,6%,4%
,,," On selling 17 balls at Rs. 720, there is a loss equal to the cost price of 5 balls. The cost price of a ball is:",,,,,,4,4,Rs. 45,Rs. 50,Rs. 55,Rs. 60
,,," When a plot is sold for Rs. 18,700, the owner loses 15%. At what price must that plot be sold in order to gain 15%?",,,,,,4,3,"Rs. 21,000","Rs. 22,500","Rs. 25,300","Rs. 25,800"
,,, A trader mixes 26 kg of rice at Rs. 20 per kg with 30 kg of rice of other variety at Rs. 36 per kg and sells the mixture at Rs. 30 per kg. His profit percent is:,,,,,,4,2,"No profit, no loss",5%,8%,10%
,,," A trader marked the selling price of an article at 10% above the cost price. At the time of selling, he allows certain discount and suffers a loss of 1%. He allowed a discount of :",,,,,,4,1,10 %,10.5 %,11 %,12.5 %
,,, The cost price of an article is 64% of the marked price. Calculate the gain percent after allowing a discount of 12%.,,,,,,4,1,37.5 %,38.5 %,42 %,27.5 %
